{
  "catalogId": "catalog:5a39cf75d47a272402feb870826007130bbec41783544ed1f4add23becbe9999",
  "generatedAt": "2026-01-01T00:00:00.000Z",
  "plugins": [
    {
      "authors": [
        "Anthropic"
      ],
      "availableReleases": [
        {
          "canonicalContentDigest": "sha256:10462f80a006c7d518fcccb34d09981bf7fda532c4d0974e525ec2555a6a1ff0",
          "capabilities": [
            {
              "metadata": {},
              "name": "command",
              "paths": [
                "commands/prospect.md"
              ],
              "securityImpact": "none",
              "type": "command"
            }
          ],
          "contentResolution": "complete",
          "fileIndex": [
            "commands/prospect.md",
            "plugin.json"
          ],
          "manifestDigest": "sha256:885d9f4dc5ff4ebdf456c71f0c5b8216d8ec327847a835f070ba0e4141cf46c8",
          "permissionSensitiveChanges": [],
          "pluginSubdirectory": "plugins/sales",
          "publicationTimestamp": "2026-01-01T00:00:00.000Z",
          "releaseId": "release:dc304fb0c5f79f0fccbba74dcb29b78049d6972eadd084d05935384755b5a1f4",
          "releaseMetadata": {
            "marketplaceEntry": {
              "category": "sales",
              "description": "Prepare sales work.",
              "name": "sales",
              "source": {
                "path": "plugins/sales",
                "source": "local"
              }
            },
            "pluginManifest": {
              "license": "MIT",
              "name": "sales",
              "version": "1.1.0"
            },
            "sourceDialect": "claude"
          },
          "requiredConnectors": [],
          "requiredCredentials": [],
          "resolvedCommitSha": "3333333333333333333333333333333333333333",
          "resolvedRepositoryUrl": "https://github.com/anthropics/claude-plugins-official",
          "upstreamVersion": "1.1.0"
        }
      ],
      "capabilitySummary": {
        "command": 1
      },
      "categories": [
        "sales"
      ],
      "currentReleaseId": "release:dc304fb0c5f79f0fccbba74dcb29b78049d6972eadd084d05935384755b5a1f4",
      "description": "Prepare sales work.",
      "displayName": "sales",
      "harnessCompatibility": {
        "claude-code": {
          "reasons": [
            "The claude marketplace dialect matches the claude-code harness."
          ],
          "responsibleCapabilities": [
            "command"
          ],
          "status": "native"
        },
        "codex": {
          "reasons": [
            "Files can be copied or translated into the harness layout."
          ],
          "responsibleCapabilities": [
            "command"
          ],
          "status": "portable"
        },
        "cursor": {
          "reasons": [
            "Files can be copied or translated into the harness layout."
          ],
          "responsibleCapabilities": [
            "command"
          ],
          "status": "portable"
        },
        "generic-skill-mcp": {
          "reasons": [
            "Files can be copied or translated into the harness layout."
          ],
          "responsibleCapabilities": [
            "command"
          ],
          "status": "portable"
        },
        "hermes": {
          "reasons": [
            "Files can be copied or translated into the harness layout."
          ],
          "responsibleCapabilities": [
            "command"
          ],
          "status": "portable"
        },
        "opencode": {
          "reasons": [
            "Files can be copied or translated into the harness layout."
          ],
          "responsibleCapabilities": [
            "command"
          ],
          "status": "portable"
        },
        "pi": {
          "reasons": [
            "Files can be copied or translated into the harness layout."
          ],
          "responsibleCapabilities": [
            "command"
          ],
          "status": "portable"
        }
      },
      "icons": [],
      "keywords": [
        "sales"
      ],
      "license": {
        "name": "MIT",
        "source": "plugin-manifest"
      },
      "pluginId": "plugin:claude-official:sales",
      "productGroupingKey": "sales",
      "provenance": {
        "manifestPath": ".claude-plugin/marketplace.json",
        "pluginSubdirectory": "plugins/sales",
        "repositoryUrl": "https://github.com/anthropics/claude-plugins-official",
        "resolvedCommitSha": "3333333333333333333333333333333333333333",
        "sourceId": "claude-official",
        "sourceManifestDigest": "sha256:1803d9b09fa8588d3cce1c3f52c27bcd991d4e916beffc4ca07ce0c690cf58cb",
        "upstreamEntryDigest": "sha256:851548b8b412bf832e4fcdf344b4babc0963d423a56771ee7f04f3b1c9f68b20"
      },
      "securityClassification": {
        "contentResolution": "complete",
        "level": "low",
        "permissionSensitiveChanges": [],
        "reasons": [
          "No permission-sensitive executable capability was detected."
        ]
      },
      "sourceId": "claude-official",
      "upstreamPluginName": "sales"
    },
    {
      "authors": [
        "Anthropic"
      ],
      "availableReleases": [
        {
          "canonicalContentDigest": "sha256:8e18e64bebacea3c1de7a42034154db464616a94901f7b71c46cdf75351e800b",
          "capabilities": [
            {
              "metadata": {},
              "name": "executable",
              "paths": [
                "hooks/on-save.sh"
              ],
              "securityImpact": "sensitive",
              "type": "executable"
            },
            {
              "metadata": {},
              "name": "hook",
              "paths": [
                "hooks/on-save.sh"
              ],
              "securityImpact": "sensitive",
              "type": "hook"
            },
            {
              "metadata": {},
              "name": "skill",
              "paths": [
                "skills/audit/SKILL.md"
              ],
              "securityImpact": "none",
              "type": "skill"
            }
          ],
          "contentResolution": "complete",
          "fileIndex": [
            ".claude-plugin/plugin.json",
            "hooks/on-save.sh",
            "skills/audit/SKILL.md"
          ],
          "manifestDigest": "sha256:d0a430c1780d06eaf37eb43ab9a4688d5a5fa30dfadb42aa00d9186977faec1c",
          "permissionSensitiveChanges": [
            "executable",
            "hook"
          ],
          "pluginSubdirectory": "plugins/security",
          "publicationTimestamp": "2026-01-01T00:00:00.000Z",
          "releaseId": "release:5b02dbca6c6abb490bec11acb3e72e366d15232e9855f8b7cca4363bf596f932",
          "releaseMetadata": {
            "marketplaceEntry": {
              "category": "security",
              "description": "Audit application security.",
              "displayName": "Security",
              "name": "security",
              "source": "./plugins/security"
            },
            "pluginManifest": {
              "displayName": "Security",
              "license": "Apache-2.0",
              "name": "security",
              "version": "1.0.0"
            },
            "sourceDialect": "claude"
          },
          "requiredConnectors": [],
          "requiredCredentials": [],
          "resolvedCommitSha": "3333333333333333333333333333333333333333",
          "resolvedRepositoryUrl": "https://github.com/anthropics/claude-plugins-official",
          "upstreamVersion": "1.0.0"
        }
      ],
      "capabilitySummary": {
        "executable": 1,
        "hook": 1,
        "skill": 1
      },
      "categories": [
        "security"
      ],
      "currentReleaseId": "release:5b02dbca6c6abb490bec11acb3e72e366d15232e9855f8b7cca4363bf596f932",
      "description": "Audit application security.",
      "displayName": "Security",
      "harnessCompatibility": {
        "claude-code": {
          "reasons": [
            "Executable components require harness-specific execution authority."
          ],
          "responsibleCapabilities": [
            "executable",
            "hook",
            "skill"
          ],
          "status": "unsupported"
        },
        "codex": {
          "reasons": [
            "Executable components require harness-specific execution authority."
          ],
          "responsibleCapabilities": [
            "executable",
            "hook",
            "skill"
          ],
          "status": "unsupported"
        },
        "cursor": {
          "reasons": [
            "Executable components require harness-specific execution authority."
          ],
          "responsibleCapabilities": [
            "executable",
            "hook",
            "skill"
          ],
          "status": "unsupported"
        },
        "generic-skill-mcp": {
          "reasons": [
            "Executable components require harness-specific execution authority."
          ],
          "responsibleCapabilities": [
            "executable",
            "hook",
            "skill"
          ],
          "status": "unsupported"
        },
        "hermes": {
          "reasons": [
            "Executable components require harness-specific execution authority."
          ],
          "responsibleCapabilities": [
            "executable",
            "hook",
            "skill"
          ],
          "status": "unsupported"
        },
        "opencode": {
          "reasons": [
            "Executable components require harness-specific execution authority."
          ],
          "responsibleCapabilities": [
            "executable",
            "hook",
            "skill"
          ],
          "status": "unsupported"
        },
        "pi": {
          "reasons": [
            "Executable components require harness-specific execution authority."
          ],
          "responsibleCapabilities": [
            "executable",
            "hook",
            "skill"
          ],